#,Product Name,ASIN,Brand,Category,Price (£),Rank,Mo. Sales,Revenue (£),Reviews,First review date,Rating,Weight (lbs),Url
1,"COTOP Motorcycle Gloves, Hard Knuckle Touch Screen Gloves Motorcycle Gloves Motorbike ATV Riding Full Finger Gloves for Men (M)",B01M8PPMBK,COTOP,Automotive,14.99,1376,177,2653,510,,4.1,0.12,https://www.amazon.co.uk/dp/B01M8PPMBK/
2,"GES Men Outdoor Motorbike Waterproof Gloves Motorcycle Full Finger Touch Screen Racing Motocross Gloves (M, Red)",B0785J8M18,GES,Automotive,9.99,13874,20,200,367,,3.8,0.16,https://www.amazon.co.uk/dp/B0785J8M18/
3,Gloves Fox Dirtpaw Black L,B07DD3JMK5,Fox Racing,Automotive,0,9942,28,,858,Mar 27 2019,4.4,0.1,https://www.amazon.co.uk/dp/B07DD3JMK5/
4,Leopard Adult & Child Kids MX Motocross Gloves Dirty Bike Quad Motorcycle Motorbike Gloves,B06VS9CT1S,Leopard,Sports & Outdoors,9.99,17334,51,509,472,,4.4,N/A,https://www.amazon.co.uk/dp/B06VS9CT1S/
5,Fox Racing Dirtpaw Race Motocross Gloves,B073WVH2YG,Fox,--,0,N/A,,,49,Feb 24 2018,4.0,0.09,https://www.amazon.co.uk/dp/B073WVH2YG/
6,ISLERO Heavy Duty All Weather Motor Bike Motorcycle ATV paintball outdoors sports Full Finger Gloves Carbon Fiber Knuckle Hiking Climbing Racing Riding Cycling Smart Phone Capacitive Touch Compatible Gloves,B07DYRXWT4,Islero,--,13.99,N/A,,,107,,4.1,0.22,https://www.amazon.co.uk/dp/B07DYRXWT4/
7,"Cozone Fingerless Hard Knuckle Protection Motorcycle/Cycling Outdoor Gloves, Half Finger Mens Gloves for Gym/Training/Shooting/Airsoft/Climbing/Camping",B07DL1GSQW,Cozone,Sports & Outdoors,9.89,9448,82,811,44,,4.3,N/A,https://www.amazon.co.uk/dp/B07DL1GSQW/
8,Short Summer Mens Motorbike Motorcycle Gloves Mountain Riding Bike Sports Glove - Blue XL,B07FSCWFT7,REXTEK,Automotive,0,168522,2,,7,,3.9,N/A,https://www.amazon.co.uk/dp/B07FSCWFT7/
9,Wulfsport Kids Children Attack Motocross Motorbike Gloves Junior Off Eoad Trials Mountain Bike - Green XS,B073GYMQWC,Wulf,Automotive,0,31450,9,,4,,4.4,N/A,https://www.amazon.co.uk/dp/B073GYMQWC/
10,Seibertron Dirtpaw Men's Profesional Bicycle MTB Racing Off-road/Dirt bike Sports Gloves,B00IF0UI1I,Seibertron,Sports & Outdoors,15.99,9734,80,1279,401,,4.3,N/A,https://www.amazon.co.uk/dp/B00IF0UI1I/
11,TRIWONDER Cycling Gloves Mountain Road Biking Riding Gloves Breathable Wear-resisting Shock-absorbing for Men and Women,B074JC7DV4,TRIWONDER,Sports & Outdoors,9.99,12592,65,649,161,,4.3,0.06,https://www.amazon.co.uk/dp/B074JC7DV4/
12,Gloves Fox Ranger Black L,B07NH9DYZY,Fox,Automotive,27.2,35231,8,218,286,,4.4,0.02,https://www.amazon.co.uk/dp/B07NH9DYZY/
13,Qtech Kids Gloves - RED XXXS,B00K6ETK10,Qtech,Automotive,0,18053,16,,199,,4.5,N/A,https://www.amazon.co.uk/dp/B00K6ETK10/
14,Prime Full Finger Motorbike Motorcycle Sports Riding Mountain Bike Protection Summer Gloves 9001,B00UD9PTGS,Prime Sports,--,0,N/A,,,114,,4.1,0.1,https://www.amazon.co.uk/dp/B00UD9PTGS/
15,WULFSPORT Stratos Kid Glove Motorcross BMX Mountain Bike Trial Children Off Road Orange XXS 6-9 Years,B0102DH9SK,Wulf,Automotive,0,40938,7,,4,,4.3,0.1,https://www.amazon.co.uk/dp/B0102DH9SK/
16,"Fox 17291-001 Glove, Black, XL",B01DMTS85Y,Fox,Automotive,0,42854,7,,29,,4.0,0.01,https://www.amazon.co.uk/dp/B01DMTS85Y/
17,Oneal Jump 2012 Hustler Motocross Gloves,B005TSIGEK,O'Neal,--,0,N/A,,,11,,4.7,0.1,https://www.amazon.co.uk/dp/B005TSIGEK/
18,WULFSPORT STRATOS MOTORBIKE ADULT & KIDS MX GLOVES Motocross Sports Off Road Trials Enduro Quad Kart Dirt Bike Cycle ATV MTB BMX Race Adult & Junior Gloves,B072XNJQP1,WULF STRATOS GLOVES,--,0,N/A,,,56,,4.7,N/A,https://www.amazon.co.uk/dp/B072XNJQP1/
19,"SCOYCO Knuckle Motorcycle Gloves for Men and Women, Summer Mesh Armoured Protective Short Gloves for Motorbike Riding Motocross Enduro Dirt Bike MTB ATV Black",B07YDHCSQY,Scoyco,Automotive,13.99,52069,5,70,5,,4.8,0.16,https://www.amazon.co.uk/dp/B07YDHCSQY/
20,Oneal Men's Element Full Finger Mountain Enduro Motocross Dirt Bike Gloves,B01FGWWN1K,O'Neill Wetsuits,--,25.14,N/A,,,91,,4.4,N/A,https://www.amazon.co.uk/dp/B01FGWWN1K/
21,Wulfsport Attack Junior Kids Blue XS 10-12 Yrs Gloves Motocross Offroad Trials Mountain Bike,B07842K1W8,Wulf,Automotive,0,88164,3,,6,,4.4,N/A,https://www.amazon.co.uk/dp/B07842K1W8/
22,Fox Dirtpaw Glove - Race Flo Orange XL,B07VC4T3JW,Fox,Automotive,24.43,48320,6,147,256,,4.6,0,https://www.amazon.co.uk/dp/B07VC4T3JW/
23,"XBTIC Leopard Full Face Off Road Motocross Quad Crash Helmet ECE Downhill Dirt Bike MX ATV Adult Motorbike Helmet Gloves, Goggles, Mask 4 Piece Set (Matt Black + Star)",B07JGN48PQ,XBTIC,--,0,N/A,,,9,,4.5,N/A,https://www.amazon.co.uk/dp/B07JGN48PQ/
24,INBIKE Motorbike Gloves Mens Protection Motorcycle Leathers Black Full Finger All Season Touch Screen YKK Zipper Glove IM805,B07JWFY8JP,INBIKE,--,36.99,N/A,,,222,,4.3,N/A,https://www.amazon.co.uk/dp/B07JWFY8JP/
25,100% BRISKER ADULT MOTORBIKE MX GLOVES NEW 2019 Motocross Trials Enduro Quad Dirt PIT Kart Bike ATV MTB Off Road Sports Racing Cold Weather Gloves,B07PPJ6RZN,100 Percent,--,26.99,N/A,,,2,,4.5,N/A,https://www.amazon.co.uk/dp/B07PPJ6RZN/
26,BOOM Prime Motorbike Motorcycle Gloves Full Finger Leather High Visibility All Weather Thermal Winter Summer Cycling Waterproof Windproof Knuckle Protector Bike Riding MTB Gloves (S),B078L5NLNY,BOOM Prime,Automotive,0,179720,2,,1,,4.0,N/A,https://www.amazon.co.uk/dp/B078L5NLNY/
27,Wulfsport Air 5 Junior Kids Blue XXS 6-9 Yrs Motocross MX Trial Bike Mountain Pit Dirt Quad ATV,B077NB1T7F,Wulf,Automotive,0,73609,4,,11,,4.6,N/A,https://www.amazon.co.uk/dp/B077NB1T7F/
28,Kids Mx Gloves Wulfsport Stratos Junior Motocross Quad Dirt Bike Cub Enduro Off Road Gloves Blue,B071JM2SMK,Wulf,--,11.99,N/A,,,1,,5.0,N/A,https://www.amazon.co.uk/dp/B071JM2SMK/
29,"Winter Motorcycle Gloves Waterproof Touchscreen, Windproof Warm Long Cuff Motorbike Gloves Mens Womens for Scooter, Moped, Moto Cross, Bike, Winter Hiking, Outdoor Sports - L Grey",B0819N1TK5,RunSnail,Automotive,15.99,85449,3,48,163,,4.1,0.2,https://www.amazon.co.uk/dp/B0819N1TK5/
30,"SCOYCO Carbon Fiber Appearance Knuckle Motorcycle Gloves, Full Finger Lightweight Stretch Gloves with Rubber Anti Impact Protection for Motorbike Riding Motocross Racing Enduro Dirt Bike MTB ATV Black",B00E944GYE,Scoyco,Automotive,16.99,96149,3,51,1,,5.0,0.14,https://www.amazon.co.uk/dp/B00E944GYE/
31,Qtech Childrens Kids Motocross MX Gloves - Skeleton - BMX Pit Dirt Cycle ATV Quad Bike - White XXXS,B07V96L934,Qtech,Automotive,0,160585,2,,3,,5.0,N/A,https://www.amazon.co.uk/dp/B07V96L934/
32,"LKN 1 Pair Motorbike Riding Gloves Full Finger Motorcycle Sports Mountain Bike Protection Gloves (L, Orange)",B073JDJ6PQ,LKN,Automotive,13.94,100080,3,42,46,,4.1,0.16,https://www.amazon.co.uk/dp/B073JDJ6PQ/
33,"Motorcycle Mountain Bike Handlebar Gloves, Winter Neoprene Waterproof Protection Handlebar Gloves Warm Mitts Mittens Cycling Handlebar Muffs Hand Covers",B07JXY3LKS,BETTERLE,Automotive,18.98,262445,1,19,0,--,3.9,N/A,https://www.amazon.co.uk/dp/B07JXY3LKS/
34,Yuanu Motorbike Gloves Protective Gloves Breathable Lightweight Anti-Skid Outdoor Sports Full Finger Gloves Dirt Bike Racing Knitted Cloth Motorcycle Gloves For Men,B085HJ8TXG,Yuanu,--,6.38,N/A,,,0,--,4.8,N/A,https://www.amazon.co.uk/dp/B085HJ8TXG/
35,"Motorbike Gloves Touchscreen Full Finger Lightweight with Hard Knuckle Ideal Gear Accessories Fit For Dirt Bike ATV Motorbike Cycling Outdoor Powersports Men Women(Black,L)",B0798J3RLR,ILM,Automotive,10.98,68875,4,44,136,,4.4,0.11,https://www.amazon.co.uk/dp/B0798J3RLR/
36,"SHANREN Motocross Helmet Full Face Helmet Off Road Crash Helmet with Visor, Motorbikehelmet Mask Gloves Goggles, Mountain Bike Helmet Protective Gear Dirt Bike Helmet Kids Quad Bike Helmet",B083Z6LWM8,SHANREN,--,47.06,N/A,,,0,--,4.0,N/A,https://www.amazon.co.uk/dp/B083Z6LWM8/
37,Ranger Fire Glove Black,B07VC71521,Fox,Automotive,25.5,641955,0,0,5,,4.5,0.07,https://www.amazon.co.uk/dp/B07VC71521/
38,Lerway Cycling Bike Bicycle Motobike Motorcycle Monster Outdoor Sports Gloves Keychai,B00MUPZV1Q,LERWAY,Sports & Outdoors,0,1075278,16,,409,,4.2,N/A,https://www.amazon.co.uk/dp/B00MUPZV1Q/
39,Wulfsport Adult Attack Motocross Gloves MX Motorcycle Motorbike Gloves - Red M,B073GZ1G1V,Wulf,Automotive,13.85,277414,1,14,1,,4.0,N/A,https://www.amazon.co.uk/dp/B073GZ1G1V/
40,Leopard LEO-X16 Kids Motocross HELMET & GLOVES & GOGGLES (Orange L) Children Quad Bike ATV Go Karting Helmet,B015QWHFFY,Leopard,Automotive,40.95,57903,5,205,97,,4.5,N/A,https://www.amazon.co.uk/dp/B015QWHFFY/
41,O`Neal ELEMENT Glove blue,B000Q7H708,O'Neal,--,16.95,N/A,,,14,,3.5,0.1,https://www.amazon.co.uk/dp/B000Q7H708/
42,Gloves Fox Defend Black/Black M,B07NHD74DL,Fox,Automotive,37.9,56830,5,190,26,,4.4,0.07,https://www.amazon.co.uk/dp/B07NHD74DL/
43,Royal Men Gear Premium Leather Motorbike Motorcycle Gloves Touch Screen Gloves with Knuckle Protection Racing gloves Riding Gloves (Medium),B07NZV37LD,Royal Men Gear,Automotive,19.99,24118,12,240,47,,3.9,0.2,https://www.amazon.co.uk/dp/B07NZV37LD/
44,"Audew Handlebar Gloves Motorcycle Handlebar Windproof Winter Thick Warm Handlebar Muffs Thermal Cover Gloves for Motorcycles, Scooters and Snowmobiles Black",B015J5Z02S,Audew,Automotive,15.99,35600,8,128,574,,4.0,0,https://www.amazon.co.uk/dp/B015J5Z02S/
45,Islero Professional Leather Motorbike Motorcycle Gloves Windproof Carbon Fiber Knuckle Racing Thinsulate Hipora Smartphone Touch Compatible Winter Thermal Inner Gloves Included FREE,B01MQQVS0H,Islero,--,21.99,N/A,,,165,,3.9,1,https://www.amazon.co.uk/dp/B01MQQVS0H/
46,Wulfsport Adult Stratos MX Motorbike Gloves Motocross Sports Off Road Racing Gloves - Blue L,B075Q61NQ9,Wulf,Automotive,13.85,492680,1,14,5,,3.5,N/A,https://www.amazon.co.uk/dp/B075Q61NQ9/
47,"DJLHNNew NAUGHTY FOX Pink Blue Gloves Motorbike Riding Dirt Bike Mountain Cycling Motorcycle DIRTPAW Race Gloves - Pink,S",B0843B2X8K,DJLHN,Automotive,24.99,35717,8,200,0,--,4.0,N/A,https://www.amazon.co.uk/dp/B0843B2X8K/
48,Leopard CUB Children Kids Motocross Motorbike Gloves Dirty Quad Bike ATV Karting Gloves - Green XL - 8CM,B07JXY4MDY,Leopard,Automotive,9.99,203783,1,10,6,,5.0,0.07,https://www.amazon.co.uk/dp/B07JXY4MDY/
49,"Evo New Leather Motorbike Motorcycle Bike Heavy Duty Waterproof Winter Thermal Carbon Shell Gloves""Winter Thermal Inner Gloves Included FREE"" (Large)",B01GK48UC4,EVO Fitness,Automotive,21.99,18853,15,330,304,,4.3,0.32,https://www.amazon.co.uk/dp/B01GK48UC4/
50,Wulfsport Children Kids Stratos Motocross Motorbike Gloves (Blue XS 7cm) ATV Dirt Quad Bike Off Road Gloves,B07K7GVM88,Wulf,Automotive,13.49,100766,3,40,0,--,4.7,N/A,https://www.amazon.co.uk/dp/B07K7GVM88/
51,"LEENY Motocross Crash Helmet with Goggles Mask Gloves, Motorcycle Off-Road DH Enduro Racing Downhill Dirt Bikes MTB ATV BMX Quads Motorbike Helmet for Adult Men Women",B07QVCB5ZT,LEENY,--,45.99,N/A,,,2,,5.0,N/A,https://www.amazon.co.uk/dp/B07QVCB5ZT/
52,Alpinestars Men's Aspen Wr Pro Glove,B078H7KQV6,Alpinestars,Sports & Outdoors,26.98,656845,16,432,3,,5.0,0.09,https://www.amazon.co.uk/dp/B078H7KQV6/
53,Texpeed Red & Black Protective Leather Motorbike/Motorcycle Gloves - All Sizes,B008ELHNJ8,Texpeed,Automotive,0,56811,5,,153,,4.4,0.28,https://www.amazon.co.uk/dp/B008ELHNJ8/
54,Leopard LEO-X16 Kids Motocross HELMET & GLOVES Children Dirt Bike ATV Quad Motorbike Helmet,B015QWHVMG,Leopard,--,36.95,N/A,,,27,,4.2,N/A,https://www.amazon.co.uk/dp/B015QWHVMG/
55,"Savior Motorcycle Heated Gloves for Men and Women, Palm Leather Gloves for Winter Skiing，Skating, Running, Walking, 7.4V 2200 Mah Electric Rechargeable Batteries Gloves, Works Up To 2.5-5 Hours",B071WRZ7YG,Savior,Sports & Outdoors,129.99,83145,23,2990,437,,4.2,1,https://www.amazon.co.uk/dp/B071WRZ7YG/
56,Hand Fellow Premium Leather Motorbike Motorcycle Gloves Touch Screen Gloves with Knuckle Protection Racing gloves Riding Gloves (XX Large),B07GCMJC7J,Hand Fellow,Automotive,16.99,35041,8,136,73,,4.1,0.19,https://www.amazon.co.uk/dp/B07GCMJC7J/
57,"O 'Neal Matrix Wingman Childrens Bike Gloves, Children's, Matrix Wingman",B011DTPXQW,O'Neal,Sports & Outdoors,11.95,543567,16,191,7,,3.8,0.07,https://www.amazon.co.uk/dp/B011DTPXQW/
58,Wulfsport 2020 Off Road Pro Children Kids Motocross Helmet + Kids Attack Gloves + Goggles,B0185OS49Q,Wulf,--,65.99,N/A,,,1,,5.0,N/A,https://www.amazon.co.uk/dp/B0185OS49Q/
59,Mens Black 600D Cordura Waterproof Textile & Leather Motorcycle/Motorbike Gloves,B07DL6L6DN,Texpeed,Automotive,0,84657,3,,44,,4.2,N/A,https://www.amazon.co.uk/dp/B07DL6L6DN/
60,Leopard LEO-X16 Green Kids Motocross Helmet (M 51-52cm) & Gloves (M 6cm) & Goggles & Camo Motocross Suit Jacket (S 5-6 Yrs),B0744J8VYD,Leopard,Automotive,59.99,30956,9,540,19,,4.3,N/A,https://www.amazon.co.uk/dp/B0744J8VYD/
61,Leopard LEO-X15 Red Kids Motocross Motorbike Helmet (S 49-50cm) & Gloves (S 5cm) & Goggles + Kids CAMO Motocross 1PC Suit (S 5-6Yrs),B0744HY7C5,Leopard,Automotive,56.99,31844,9,513,20,,4.6,N/A,https://www.amazon.co.uk/dp/B0744HY7C5/
62,"SCOYCO Mens Hard Knuckle Motorcycle Gloves, Sports Gloves with Rubber Wrist Protection for Motorbike Riding Motocross Racing Enduro Dirt Bike MTB ATV Red",B07YDX3GKT,Scoyco,Automotive,16.99,14474,19,323,2,,5.0,0.14,https://www.amazon.co.uk/dp/B07YDX3GKT/
63,Fox Dirtpaw Race Gloves orange,B001GQFC4G,Fox Racing,Automotive,24.99,502444,1,25,66,,4.5,0.1,https://www.amazon.co.uk/dp/B001GQFC4G/
64,Motorcycle Gloves for Men's Woman's Breathable Off-road Racing Motorbike Gloves Knuckle Protection Padding Touch Screen Driving Gloves,B07N7DCJFB,BORLENI,--,14.99,N/A,,,115,,3.8,N/A,https://www.amazon.co.uk/dp/B07N7DCJFB/
65,Gloves Fox Flexair Black L,B07NDTTTS8,Fox,Automotive,0,171847,2,,4,,2.1,0.05,https://www.amazon.co.uk/dp/B07NDTTTS8/
66,"Muc-Off 154 Cut-Resistant Mechanics Gloves, L",B07847CT9B,Muc Off,Automotive,0,3745,72,,55,,4.2,0.04,https://www.amazon.co.uk/dp/B07847CT9B/
67,Black Winter Waterproof Leather Gloves 4 Motorbike Knuckle Guard,B016XAL3XI,GearX,--,0,N/A,,,509,,4.3,N/A,https://www.amazon.co.uk/dp/B016XAL3XI/
68,Troy Lee Designs Gloves GP,B015YJQR1C,Troy Lee Designs,--,19.99,N/A,,,0,--,4.3,0.14,https://www.amazon.co.uk/dp/B015YJQR1C/
69,EVO Professional Leather Motorbike Motorcycle Gloves Heavy Duty Thinsulate 3M Hipora Windproof Waterproof Winter All Weather Thermal Carbon Shell Fiber Knuckle Smartphone Touch Compatible Gloves,B0711VMJWW,EVO Fitness,--,16.99,N/A,,,83,,4.2,0.25,https://www.amazon.co.uk/dp/B0711VMJWW/
70,Motorcycle Gloves Leather Touch Screen Men Cycling Glove Motorbike Racing guantes de moto luvas de motocicleta&nbsp;-Perforated Brown-8-XL,B086RP92Z3,IAMZHL,Automotive,33.47,105495,3,100,0,--,4.1,N/A,https://www.amazon.co.uk/dp/B086RP92Z3/
71,O`Neal Fingerless WIRED Glove,B01J51RA1Q,O'Neal,Automotive,19.99,59997,5,100,10,,4.2,0.09,https://www.amazon.co.uk/dp/B01J51RA1Q/
72,"O'Neal Mayhem Rizer MTB Fahrrad Handschuhe DH Downhill All Mountain Bike MX Cross, 0385, Farbe Grau, Größe S",B07F2PCMWR,O'Neal,Automotive,29,431522,1,29,0,--,4.4,0.12,https://www.amazon.co.uk/dp/B07F2PCMWR/
73,Islero All Weather Pure Leather Motorbike Gloves motorcycle Bike Working Wheelchair,B07FF1QSFX,Islero,--,9.99,N/A,,,5,,4.6,1,https://www.amazon.co.uk/dp/B07FF1QSFX/
74,MTCTK Adult ROCKSTAR motocross helmet gifts goggles mask gloves moto racing full face helmet for man and woman,B07TLL3PMK,MTCTK,--,44.88,N/A,,,6,,4.2,N/A,https://www.amazon.co.uk/dp/B07TLL3PMK/
75,0399K-803 - Oneal Element Kids Racewear 2015 Motocross Gloves M Blue,B00N43227O,Oneal,Sports & Outdoors,16.95,106159,21,356,2,,3.0,0.08,https://www.amazon.co.uk/dp/B00N43227O/
76,"ZJRA Adult Rockstar Motocross Helmet,MX Motorcycle Helmet Dirt Bike ATV Scooter DOT Certified Motorbike Helmet with Goggles Gloves Mask,L58~59cm",B07WFRRP7V,ZJRA,Automotive,0,34207,8,,0,--,4.7,N/A,https://www.amazon.co.uk/dp/B07WFRRP7V/
77,"Viper Motorbike Gloves Short Summer Knuckle Protection , Black, XL",B00R0C61VS,GearX,Automotive,0,28441,10,,1,,5.0,0.13,https://www.amazon.co.uk/dp/B00R0C61VS/
78,"GES Motorbike Gloves, Men Full Finger Motorcycle Gloves Touch Screen ATV Riding Motocross Racing Gloves (Brown, L)",B07MBFVJB3,GES,Automotive,12.99,67005,4,52,57,,4.3,0.12,https://www.amazon.co.uk/dp/B07MBFVJB3/
79,2013 O'NEAL ELEMENT MOTOCROSS MX GLOVES ADULT RED bmx mtb,B008M8SYD2,O'Neal,Sports & Outdoors,17.99,123821,20,360,192,,4.3,0.28,https://www.amazon.co.uk/dp/B008M8SYD2/
80,Leopard LEO-X18 Children Kids MX Motocross Motorcycle Motorbike Helmet & Gloves - Skull M (51-52cm),B07VXDSNB8,Leopard,--,37.99,N/A,,,0,--,4.4,N/A,https://www.amazon.co.uk/dp/B07VXDSNB8/
81,Adult Motocross Helmet Off Road Motorcycle Helmet ATV Cross Dot Helmets Motocross Bike Enduro Sport Glove with Storm Mask and Glasses (8 Style),B07P964XWH,MME,--,58.43,N/A,,,0,--,4.4,N/A,https://www.amazon.co.uk/dp/B07P964XWH/
82,BOOM Prime Winter Thermal Motorcycle Motorbike Gloves Leather Waterproof Windproof Full Finger Motocross Bike Riding MTB Sports Wheelchair Driving Gloves for Men (Large),B07ZN3VQMV,BOOM Prime,Automotive,7.99,176411,2,16,0,--,4.0,N/A,https://www.amazon.co.uk/dp/B07ZN3VQMV/
83,WTACTFUL Motorcycle Gloves Touch Screen Gloves Motorbike ATV Riding Hunting Hiking Climbing Full Finger Gloves for Men,B0774JV9ZM,WTACTFUL,--,14.99,N/A,,,97,,4.4,N/A,https://www.amazon.co.uk/dp/B0774JV9ZM/
84,"Naponior Adult Motocross Helmet, Motorcycle Helmet with Goggles Gloves Mask Outdoor Sports Helmet Full Face Motorbike Crash Helmet for Downhill Off Road MTB Quad Bike Enduro Racing,B,XL",B085TNQ9XJ,Naponior,Automotive,42.99,7534,37,1591,0,--,5.0,N/A,https://www.amazon.co.uk/dp/B085TNQ9XJ/
85,"JET Motorcycle Motorbike Gloves Summer Vented Hard Knuckle Touch Screen Gloves Men ATV Riding ECCO (XS, Orange)",B07Z3NCX8F,Jet,Automotive,9.99,316655,1,10,70,,4.2,0.13,https://www.amazon.co.uk/dp/B07Z3NCX8F/
86,Bruce Dillon 2018 Naughty Fox Mx Racing Orange Gloves Enduro Racing Motocross Dirt Bike Motorcycle Cycling Glove Orange S,B07ZVPPW7Q,Bruce Dillon,Automotive,27.99,35718,8,224,0,--,4.4,N/A,https://www.amazon.co.uk/dp/B07ZVPPW7Q/
87,VIPER MOTO HANDLEBAR SCOOT MUFFS MOTORBIKE THERMAL HAND PROTECTOR WINDPROOF UNIVERSAL MITTS WARMER GLOVES ALL YEAR GRIP COVERS,B07GS9ZX3C,VIPER Rider,Automotive,14.95,18113,16,239,1,,5.0,0.32,https://www.amazon.co.uk/dp/B07GS9ZX3C/
88,"Full Finger Goatskin Leather Motorcycle Motorbike Gloves Touchscreen Motorbike Riding Gloves For Men (Non-Perforated,L)",B07KWYCVJL,Superbike,Automotive,20.99,56050,5,105,21,,4.0,0.15,https://www.amazon.co.uk/dp/B07KWYCVJL/
89,Alpinestars Scheme Textile Motorcycle Gloves,B007IYDL5W,Alpinestars,--,44.99,N/A,,,3,,4.8,0.5,https://www.amazon.co.uk/dp/B007IYDL5W/
90,"Ladies Cow Hide Leather Full Finger Summer Motorbike Mountain Bike knuckle Protection Racing Gloves 9001 LDY (9001 Purple LDY, XS)",B07D8WTQM8,ADM,Automotive,0,93262,3,,25,,4.2,0.1,https://www.amazon.co.uk/dp/B07D8WTQM8/
91,"LN Lna Namaa Mens Classic Driving Gloves Genuine Soft Leather Dress Fashion Motor Bike Glove Vintage Style LN101 (Medium, Brown)",B017KTJZTU,LN Lna Namaa,Automotive,12.95,154539,2,26,2,,5.0,N/A,https://www.amazon.co.uk/dp/B017KTJZTU/
92,INBIKE Motorcycle Gloves Leather Motorbike All Season Full Finger Breathable Racing Touch Screen Glove IM801,B07VVJ2Q29,INBIKE,--,29.99,N/A,,,168,,3.9,N/A,https://www.amazon.co.uk/dp/B07VVJ2Q29/
93,RST 2105 Jet City CE Approved Leather Motorcycle Bike Gloves - Black XL,B079NJ2N7H,RST,Automotive,29.99,209758,1,30,8,,3.8,0.28,https://www.amazon.co.uk/dp/B079NJ2N7H/
94,Thermal Motorbike Motorcycle Leather Gloves Waterproof Protection Winter Summer,B01MTZTH5V,NORMAN,--,9.99,N/A,,,317,,4.2,N/A,https://www.amazon.co.uk/dp/B01MTZTH5V/
95,"O'Neal Mayhem Rizer MTB Fahrrad Handschuhe DH Downhill All Mountain Bike MX Cross, 0385, Farbe Weiß, Größe 2XL",B07F2PJG9P,O Neal,Automotive,29,51598,6,174,0,--,4.7,0.09,https://www.amazon.co.uk/dp/B07F2PJG9P/
96,Richa Judy GTX Gore-Tex Waterproof Touring Motorbike Motorcycle Gloves - Black,B073X2NTQ6,Richa,--,74.99,N/A,,,0,--,3.3,0.33,https://www.amazon.co.uk/dp/B073X2NTQ6/
