ASIN,Brand,Title,Category,BuyBox,#,Fulfillment ,Price,FBA fee,Sales,Revenue,BSR,Rating,Review Count,Review Velocity,Dimensions,Weight,Size Tier,Images,,
"B07SR5PM7Y","($) KIREILA","($) New Generation Plagiocephaly Baby Pillow Removable Anti-suffocation Hypoallergenic Ergonomic Orthopedic Memory Foam Prevention And Care Of The Flat Head 0-12 Months For Baby Cot Stroller","($) Baby Products","($) ","1","FBA","19.90","6.00","0","0.00","177,619","4.5","13","3","9.1x9.9x1.9","0.62","Large Standard-Size","6",,
"B086VTSLKV","GAX","GAX Baby Wedge Foam Pillow - Anti Reflux and Colic Congestion | Universal Bassinet | Pram | Moses | Basket | Stroller | Crib | Cot Bed - Toddler Sleep Safety Pillows (1 Pack)","Baby Products",,"1","MFN","25.95","0.00","58","1,505.10","2,023","-1","0","0","n/a","n/a","n/a","4",,
"B085LN2NZT","Comfortos","Comfortos Baby Wedge Foam Pillow - Anti Reflux and Colic Congestion Cushion Crib Cot Flat Head | Universal Bassinet | Pram | Moses | Basket | Stroller | Bed - Toddler Sleep Safety Pillows","Baby Products",,"1","MFN","9.95","0.00","109","1,084.55","5,272","1","2","0","n/a","n/a","n/a","6",,
"B0713RQHFT","Sensillo","Wedge Pillow Anti Reflux Colic Cushion for Baby Cot or Cot Bed 30x37 cm","Baby Products",,"1","MFN","11.99","0.00",,,,"4","1","0","n/a","n/a","n/a","2",,
"B082V3B6ZN","BabyTools","Wedge Anti-Reflux Baby Pillow|Memory Foam Anti-Suffocation Pillow For Baby Cot, Plagiocephaly|Gift For Baby Essentials With Removable Pillowcase|(OEKO-TEX® CERTIFICATE) Made in EU","Baby Products",,"1","FBA","25.95","6.16","16","415.20","7,913","4.5","21","2","11.5x14.9x3.1","0.4","Large Standard-Size","7",,
"B008Y2DFLM","Clevamama","ClevaMama ClevaFoam Baby Pillow for Newborn, Prevent Flat Head Syndrome, Breathable, for 0 - 12 months - White, 23x40 cm","Baby Products",,"3","AMZ","14.99","4.52","407","6,100.93","847","4.5","1,287","17","9.8x15.4x1.8","0.79","Large Standard-Size","12",,
"B0759YD8QH","Abco Tech","Pregnancy Wedge Pillow for Maternity – Unparalleled Support – Relieves Pain – Supports Your Belly, Back, Leg, Hip & Knees – Memory Foam Pillow - Compact & Portable – Comfortable – Washable Cover","Home & Kitchen",,"1","MFN","21.95","5.56","31","680.45","35,795","4","294","8","6.9x13.6x6.7","0.8","Large Standard-Size","9",,
"B004M3PS4O","Clevamama","ClevaMama ClevaFoam Toddler Pillow, Breathable and Anti-Allergy, Correct Alignment of the Spine, for 1 - 2 - 3 Years kids - White, 50x30 cm","Baby Products",,"2","AMZ","20.75","7.11","1,351","28,033.25","239","4.5","1,487","84","13.7x19.8x3.0","1.46","Small Oversize","10",,
"B074J9MFHK","Bluemoon Bedding®","Bluemoon Bedding® Baby Breath Easy Sleep Wedge Pillow - Pram Moses Basket Crib -Helps Colic Reflux","Baby Products",,"1","MFN","9.95","0.00","33","328.35","6,162","5","1","0","n/a","n/a","n/a","4",,
"B01M1H5PKB","Mothercare","Mothercare Wedge Pillow","Baby Products",,"3","FBA","24.99","5.89","25","624.75","11,456","4","45","0","10.3x10.9x3.9","0.49","Large Standard-Size","2",,
"B07R7K4BQB","benignpoet","Baby anti-reflux wedge | Tilted pillow for baby colic - folding foam bed wedge pillow with removable washable cover (White)","Baby Products",,"1","MFN","7.25","0.00","11","79.75","35,393","4.5","4","0","n/a","n/a","n/a","8",,
"B002NYC5LI","Purple Daisies","Foam Bed Guard Bed Rail for Toddler Baby & Children - Original 100cm - 100% UK Sourced","Baby Products",,"2","FBA","15.99","6.67","577","9,226.23","1,448","4.5","1,087","17","5.6x39.6x5.1","0.75","Small Oversize","8",,
"B0822L4RW4","($) Bammax","($) Baby Pillow Flat Head Syndrome Newborn Pillow, Bammax Baby Head Shaping Pillow for Sleeping Newborn (0-12 Months), White","($) Baby Products","($) ","1","FBA","17.99","5.14","75","1,349.25","1,658","4.5","51","9","8.4x12.5x2.4","1.23","Large Standard-Size","9",,
"B07GV7DCD9","($) QUEEN ROSE","($) QUEEN ROSE Full Body Pregnancy Pillow & Maternity Pillow with Replaceable and Washable Cover (140 x 78 cm, Gray-Blue)","($) Home & Kitchen","($) ","1","FBA","47.69","12.23","23","1,096.87","77,821","4.5","31","-222","20.5x23.8x3.5","7.1","Small Oversize","7",,
"B01MZ81NEL","($) Panda","($) Panda Kids Memory Foam Bamboo Pillow (Toddler)","($) Home & Kitchen","($) ","2","MFN","24.95","7.56","16","399.20","47,789","4","146","1","9.8x18.1x2.0","1.54","Small Oversize","8",,
"B086YCR6SC","Aurelius","Aurelius Waterproof Baby Sleep Pillow Reflux Pillow Wedge 12Degree Incline,Anti-Reflux Colic Congestion for Universal Bassinet/Bassinet/Pram/Moses Basket/Stroller/Crib","Baby Products",,"1","MFN","21.99","0.00","1","21.99","57,108","-1","0","0","n/a","n/a","n/a","5",,
"B002QRRUBW","babyREFLUX","Double Pack - Wedgehog® Moses Basket Reflux Wedge (28cm) - Buy One Get One Free","Baby Products",,"3","MFN","6.99","0.00","65","454.35","4,999","4.5","268","2","n/a","n/a","n/a","9",,
"B019D3U10S","Baby Works","Baby Works Pregnancy with Bamboo Cover (Off-White)","Home & Kitchen",,"3","AMZ","11.99","5.89","38","455.62","27,160","4","110","4","10.2x10.3x5.9","0.49","Large Standard-Size","13",,
"B07XP3R6K1","newwyt","Newborn Infant CPSD Lab Approved Wedge Pillow Waterproof Large Size Memory Foam Foldable 13 Degree Incline Sleeper Acid Reflux for Large Crib, Cot","Baby Products",,"1","MFN","10.39","0.00","0","0.00","223,147","-1","0","0","n/a","n/a","n/a","5",,
"B01N9TVCGQ","Acosy Bumpers","The Little Bed - Elevation Wedge with Cover - 100% British'Nursery Grade' Foam.","Baby Products",,"1","MFN","17.99","6.22","3","53.97","25,976","-1","0","0","17.7x23.6x2.8","0.99","Small Oversize","9",,
"B07KQRV2QS","Babocush","Babocush Baby Foam Comfort Cushion, Prevents Colic & Reflux, Gentle Vibration and Heartbeat Sound, Relieves Gas & Indigestion Whilst Providing Essential Tummy Time","Baby Products",,"1","AMZ","99.00","19.93","60","5,940.00","7,842","3.5","58","0","15.4x25.4x7.1","6.83","Small Oversize","16",,
"B07N8K95F2","Clevamama","Clevamama Clevafoam Reflux Wedge - Elevated Support","Home & Kitchen",,"2","AMZ","39.89","10.24","7","279.23","148,058","3.5","29","-17","14.1x15.2x5.5","2.07","Small Oversize","6",,
"B0836J7TMC","Zihui","Zihui Baby Sleep Pillow, 12 Degree Incline Milk Anti-Reflux Pillow Memory Foam High Resilience Wedge Pillow With Removable Covers For Bassinet Pram Stroller Crib Cot Bed,36×32×7cm White","Baby Products",,"1","MFN","16.52","0.00","1","16.52","115,729","-1","0","0","n/a","n/a","n/a","8",,
"B07N327C34","PEKITAS","PEKITAS Baby Anti-Reflux Slanted Wedge Cushion, Made in Spain 50 cm Ancho - 15° Inclinación Beige","Baby Products",,"1","MFN","12.68","5.90","1","12.68","75,878","4","87","5","11.4x21.3x3.9","0.55","Small Oversize","7",,
"B0160OYPEQ","Babymoov","Babymoov Cosydream Original Ergonomic Support Newborn Reducer Smokey","Baby Products",,"1","AMZ","39.99","8.44","2,272","90,857.28","243","4.5","1,862","51","12.1x15.8x4.5","1.15","Large Standard-Size","9",,
"B082T4CRRM","WXGY","WXGY rosemaryrose Cot Wedge| Baby Anti-reflux Wedge | Tilted Pillow for Baby Colic - Folding Foam Bed Wedge Pillow with Removable Washable Cover,White lovely","Baby Products",,"1","MFN","15.51","0.00","3","46.53","59,662","-1","0","0","n/a","n/a","n/a","8",,
"B07NBSLNCK","Borda y más","Baby Wedge Pillow Anti Reflux and Colics (Two Linings Included). Several Models and Sizes Available (Plain, Mini Cot 50cm)","Baby Products",,"1","MFN","19.97","0.00","6","119.82","21,334","5","1","0","n/a","n/a","n/a","3",,
"B07XV5TCXK","LittleBloom","Toddler Pillow by Littlebloom – Hypoallergenic Certified Nontoxic Toddler Pillow with Travel Tote for Tots 18+ Months to Reduce Cranial Pressure Toddler Pillow","Baby Products",,"1","FBA","13.87","5.90",,,,"4.5","28","1","15.4x18.9x1.3","1.06","Small Oversize","7",,
"B07FKN45BV","($) i-baby","($) i-baby Baby Pillow Nursery Crib Bedding Pillow Infant Cot Pillow Bamboo Cotton Muslin Pillowcase Removable for Easy Laundrying (Pillow Blue)","($) Baby Products","($) ","2","FBA","8.90","2.98","27","240.30","5,361","4","194","16","9.1x11.4x4.7","0.44","Large Standard-Size","7",,
"B079NY4G9B","($) QUEEN ROSE","($) QUEEN ROSE Full Body Pregnancy Pillow & Maternity Pillow with Replaceable and Washable Cover (150 x 80 cm, Cotton, Grey)","($) Amazon Launchpad","($) ","1","MFN","59.99","14.36",,,,"4.5","245","0","17.5x24.9x6.4","8.69","Small Oversize","7",,
"B07WQKVHNC","($) Byre","($) Byre® Support Pillow | Premium Shredded Memory Foam Filling | Pregnancy & Maternity Body Pillow | Made in the UK | Back, Neck & Leg Pain Relief | Grey Jersey, Large","($) Home & Kitchen","($) ","1","FBA","37.99","8.54","101","3,836.99","8,192","4.5","217","0","11.4x15.1x8.7","3.88","Small Oversize","7",,
"B07XV5TCXK","($) LittleBloom","($) Toddler Pillow by Littlebloom – Hypoallergenic Certified Nontoxic Toddler Pillow with Travel Tote for Tots 18+ Months to Reduce Cranial Pressure Toddler Pillow","($) Baby Products","($) ","1","FBA","13.87","5.90",,,,"4.5","28","1","15.4x18.9x1.3","1.06","Small Oversize","7",,
"B0759YD8QH","($) Abco Tech","($) Pregnancy Wedge Pillow for Maternity – Unparalleled Support – Relieves Pain – Supports Your Belly, Back, Leg, Hip & Knees – Memory Foam Pillow - Compact & Portable – Comfortable – Washable Cover","($) Home & Kitchen","($) ","1","MFN","21.95","5.56","31","680.45","35,795","4","294","8","6.9x13.6x6.7","0.8","Large Standard-Size","9",,
"B07SS5MQZG","($) KIREILA","($) New Generation Plagiocephaly Baby Pillow Removable Anti-suffocation Hypoallergenic Ergonomic Orthopedic Memory Foam Prevention And Care Of The Flat Head 0-12 Months For Baby Cot Stroller","($) Baby Products","($) ","1","FBA","19.90","5.15","8","159.20","11,260","4.5","13","3","9.0x9.9x1.7","0.57","Large Standard-Size","7",,
"B07T5S2WJL","($) Bammax","($) Baby Pillow Toddler Pillow, Bammax Cot Pillow Flat Head Syndrome Pillow (1-8 Years) with Removable Cover - 47cm x 28cm, Yellow","($) Baby Products","($) ","1","FBA","14.99","4.69","2","29.98","62,540","4.5","48","0","9.1x9.7x4.0","1.54","Large Standard-Size","9",,
"B07RKWT6FQ","($) TEFOTO","($) TEFOTO Shredded Memory Foam Adjustable Pillow Washable Removable Bamboo Cover Queen Size Neck Shoulder Pain Relief","($) Home & Kitchen","($) ","1","FBA","24.99","6.59","169","4,223.31","6,745","4.5","181","13","4.9x16.7x4.9","3.55","Large Standard-Size","7",,
"B0748XPZHR","Milliard","Milliard Bed Bumper Foam Safety Rail Guard for Cot Bed/Toddler Junior Bed with Non-Slip Hypoallergenic Waterproof and Washable Cover; Bed Rail for Toddlers, Kids, Adults and Seniors","Baby Products",,"1","FBA","19.99","5.60","309","6,176.91","1,788","5","1,657","15","7.7x9.2x7.5","2.46","Large Standard-Size","9",,
"B00SNM4KS0","Shnuggle","Shnuggle Baby Bath with Bum Bump Support and Cosy Foam Back Rest","Baby Products",,"9","AMZ","20.99","8.34","5,007","105,096.93","36","4.5","3,021","64","15.7x24.4x12.6","2.47","Small Oversize","18",,
"B07RWYZM8P","HBselect","HBselect Memory Foam Baby Bed Guard Rail for Toddler Kids Children Adult,Soft Portable Safety Side Bed Guard Bumper with Washable Zip Cover for Cot Bed/Toddler Junior Bed (2 Pack)","Baby Products",,"1","FBA","28.99","8.41","42","1,217.58","6,754","4.5","105","3","8.6x15.6x6.4","4.85","Large Standard-Size","7",,
"B074WDZC5V","Clevamama","Clevamama Clevacushion 10in1 Nursing Pillow - Maternity and Baby Cushion (Foam, Grey)","Baby Products",,"1","AMZ","49.99","12.55","22","1,099.78","13,189","4.5","201","0","17.1x20.9x7.9","5.51","Small Oversize","9",,
"B07N8ZTLMP","Egypto","Egypto Bamboo Memory Foam Contour Cot Pillow - Cot Bed Pillow with Removable Cover (25cm x 40cm)","Baby Products",,"1","MFN","6.99","0.00","18","125.82","15,394","4","12","0","n/a","n/a","n/a","4",,
"B082NRDXZM","rosemaryrose","rosemaryrose Cot Wedge| Baby Anti-reflux Wedge | Tilted Pillow for Baby Colic - Folding Foam Bed Wedge Pillow with Removable Washable Cover,White","Baby Products",,"1","MFN","15.51","0.00","0","0.00","236,592","-1","0","0","n/a","n/a","n/a","8",,
"B07WQKVHNC","Byre","Byre® Support Pillow | Premium Shredded Memory Foam Filling | Pregnancy & Maternity Body Pillow | Made in the UK | Back, Neck & Leg Pain Relief | Grey Jersey, Large","Home & Kitchen",,"1","FBA","37.99","8.54","101","3,836.99","8,192","4.5","217","0","11.4x15.1x8.7","3.88","Small Oversize","7",,
"B01FSUZ3F8","Wedgehog®","Wedgehog® - 60 cm Bamboo Standard Cot Wedge - Reflux Wedge","Baby Products",,"1","MFN","32.99","0.00","3","98.97","13,447","-1","0","0","n/a","n/a","n/a","1",,
"B01MZ81NEL","Panda","Panda Kids Memory Foam Bamboo Pillow (Toddler)","Home & Kitchen",,"2","MFN","24.95","7.56","16","399.20","47,789","4","146","1","9.8x18.1x2.0","1.54","Small Oversize","8",,
"B07P1RYWYC","HBselect","HBselect Memory Foam Baby Bed Guard Rail for Toddler Kids Children Adult,Soft Portable Safety Side Bed Guard Bumper with Washable Zip Cover for Cot Bed/Toddler Junior Bed (1 Pack)","Baby Products",,"1","FBA","20.99","5.75","217","4,554.83","1,483","4.5","228","11","7.1x9.6x7.0","2.65","Large Standard-Size","7",,
"B07MJZMZXB","Crstal Bedding","Acid Reflux Flex Foam Support Bed Wedge Pillow Removable Zip Cover UK Made High Density Foam All Sizes Wedge 20x18x11","Baby Products",,"1","MFN","10.99","0.00","0","0.00","97,857","4.5","3","0","n/a","n/a","n/a","9",,
"B07SJRSZCR","Little Chick London","Little Chick London Multi Use Wedge Maternity Support Pillow, Star-Struck, White/Grey","Home & Kitchen",,"2","AMZ","22.99","5.59","11","252.89","211,863","3","2","0","11.8x13.5x1.6","0.71","Large Standard-Size","5",,
"B079616YS3","($) Simple Joys by Carter's","($) Simple Joys by Carter's 5-pack Long-sleeve Bodysuit Undershirt, Bears/Animals Green/Stripes, Newborn, Pack of 5","($) Clothing","($) ","1","AMZ","18.49","5.04","41","758.09","7,877","5","2,852","105","4.3x7.7x2.5","0.54","Large Standard-Size","5",,
"B07Q5ZX267","($) LULANDO","($) LULANDO 3 Star Shaped Cushions, Cushion, Star, Cotton Cushion Three Colors for Children, Decorative Cushion, Unique Room Decoration, Standard 100 by Oeko-Tex - Class I (Stars Grey)","($) Baby Products","($) ","1","MFN","14.99","8.55","4","59.96","54,179","4.5","25","1","18.1x21.0x9.6","2.34","Small Oversize","5",,
"B01MDUGJUE","($) LULANDO","($) ","($) ","($) ","n/a","N/A","0.00","0.00",,,,"5","1","n/a","n/a",,"n/a",,,
"B076F97QNX","Snoozzz","Snoozzz Sleep positioner Baby Reflux Support Anti roll Pillow - Swaddle Flat Head Syndrome aid - snoozepod Snuggle Sleepy pod - Regular","Baby Products",,"2","AMZ","37.48","8.06","23","862.04","18,573","4","227","15","7.2x11.2x3.9","1.15","Large Standard-Size","7",,
"B0744NVGPD","Shnuggle","Shnuggle Squishy Baby Changing Mat","Baby Products",,"9","AMZ","43.94","11.88","296","13,006.24","1,270","4.5","41","4","17.5x27.2x2.8","4.32","Small Oversize","12",,
"B07VRPK8NZ","AiteFeir","Baby Pillow for sleeping Memory Foam for toddler Unisex Infant Pillow Baby Head Shaping Prevent Flat Head Syndrome Breathable Washable 100% Organic Cotton Cover Newborn Gift With Baby Bib(3-36 months)","Baby Products",,"1","FBA","16.99","6.37","235","3,992.65","2,336","4.5","45","11","11.4x19.6x1.2","0.99","Small Oversize","7",,
"B07F1VWRR3","NEPPT","Wedge Pillow Body Position Wedges Back Positioning Elevation Pillow Case Pregnancy Bedroom Eevated Body Alignment Ankle Support Pillow Leg Bolster (Blue)","Home & Kitchen",,"1","MFN","33.70","7.36","5","168.50","321,410","4.5","114","9","8.0x8.6x4.6","0.9","Large Standard-Size","6",,
"B08354QLS1","CYHSHY",,,,"n/a","N/A","0.00","0.00",,,,"-1","0","n/a","n/a",,"n/a",,,
"B07X3LYKGJ","Tanku Toys","Baby Pillow Prevents Flat Head Syndrome in Newborns (0-12 Months) + Extra Washable Pillowcase | Tanku Toys Baby Cushion Designed for Comfortable Sleep, Perfect Gift for A Pregnant Mum (Blue)","Baby Products",,"1","FBA","13.99","4.37","131","1,832.69","2,558","4.5","29","4","9.9x10.6x1.7","0.66","Large Standard-Size","6",,
"B01LB6D4FE","BabyDam","BabyDam Baby Changing Mat Grey/White","Baby Products",,"1","MFN","21.99","8.17","684","15,041.16","570","4.5","265","5","20.4x27.6x4.2","1.54","Small Oversize","7",,
"B01ATL355Q","Cuddles Collection","Cuddles Collection Silver Twinkle Star Support Wedge","Baby Products",,"1","MFN","14.95","4.51","8","119.60","25,597","4","67","0","10.6x11.4x3.3","0.4","Large Standard-Size","1",,
"B07WFFZCS7","KUSUOU","Baby Anti-Reflux Wedge -Tilted Pillow for Baby Colic - Folding Foam Bed Wedge Pillow with Removable Washable Cover (D)","Baby Products",,"1","MFN","8.99","2.45","0","0.00","252,690","-1","0","0","n/a","0.69","n/a","7",,
"B07VMSXDY4","DWTTW","DWTTW Velvet Baby Pillows Side Sleeping Pillows Triangle Positioning Baby Pillows Removable and Washable Adjustable","Baby Products",,"1","MFN","20.90","0.00","1","20.90","44,622","-1","0","0","n/a","n/a","n/a","6",,
"B077D2RLZS","CompuClever","Memory Foam Pillow for Lower Back Pain Orthopedic Lumbar Support Wedge Pillow for Sciatica Pregnancy Knees and Leg Pain Waist Pillow for Sleeping on Side or Back with Washable Velvet Cover Pink","Home & Kitchen",,"1","FBA","21.99","5.60","21","461.79","39,116","4","79","1","5.3x10.0x4.5","1.1","Large Standard-Size","7",,
"B086YC72BL","Aurelius","Aurelius Baby Sleep Pillow Wedge Reflux Pillow Bed Wedge Anti Reflux and Colic Congestion with Memory Foam Fit for Universal Bed/Pram/Crib/Cot/Bassinet/Mattress","Baby Products",,"1","MFN","22.90","5.88","2","45.80","19,573","-1","0","0","5.5x12.6x5.5","1.28","Large Standard-Size","5",,
"B07N8K95F2","($) Clevamama","($) Clevamama Clevafoam Reflux Wedge - Elevated Support","($) Home & Kitchen","($) ","2","AMZ","39.89","10.24","7","279.23","148,058","3.5","29","-17","14.1x15.2x5.5","2.07","Small Oversize","6",,
"B01M3419RF","($) COMFORTNIGHTS","($) Comfortnights Large Bed Wedge with Washable, Quilted Poly Cotton Cover, Size 610 x 610 x 254 mm, 24' x 24' x 10'","($) Health & Personal Care","($) ","1","MFN","28.75","0.00","21","603.75","51,618","4","21","0","n/a","n/a","n/a","4",,
"B07W2ZD3LG","($) QUEEN ROSE","($) QUEEN ROSE Bed Wedge Pillow Memory Foam - Leg Rest Cushion Pillow for Back Support, Elevating Legs and Acid Reflux (Gray)","($) Amazon Launchpad","($) ","1","FBA","57.29","13.88",,,,"4.5","42","0","9.4x23.2x8.7","4.28","Small Oversize","6",,
